{
 "version": 1,
 "generated": "2026-08-11",
 "note": "Canonical lessons ledger. One row per decision about something the estate learned, from either intake: the harvest names the venture, the Study workflow names the sources it read and the lens it read them through. Declines and deferrals stay as rows, because a decision that leaves no trace gets argued again. registry/LESSONS.md is the derived view of this file. Schema: kernel/schemas/lesson.schema.json.",
 "preamble": [
  "The lessons ledger. Two intakes write here: the harvest, which pulls\nrulings and feedback from a governed venture, and the Study workflow,\nwhich reads a named source through a lens contract. Every row carries\na disposition that points at the file which now owns the decision, and\na declined lesson keeps its reason, so a decline cannot be re-proposed\nas if it had never been argued. A silent harvest month still records\n\"checked, clean\".",
  "Disposition is an enum. `kernel/schemas/lesson.schema.json` lists\nthe permitted values and refuses one that is not on the list, and\n`TOUR.md` is the home for what they mean: its table under \"The\neleven dispositions\" defines all eleven. Each value names the kind\nof home a decision found; the row's own `outcome` and `informs`\nname the file that holds it now. The value `binding` is absent on\npurpose: this ledger can propose a binding candidate and nothing\nmore, because binding needs an accepted ADR and Daniel under the\nladder in `GOVERNANCE.md`.",
  "**A lesson leaves this ledger once its content is stated as a rule\nsomewhere else.** Keeping it here as well would be a second home for\nthe same rule, and one of the two homes would go stale. Rows that\nrecord what changed and why are provenance, and those stay.",
  "The first PB-E02 harvest ran on 2026-08-08 against the three governed\nventures. Venture A's two entries had both already been folded during\nthe v1 build and are recorded as such below. Venture C's feedback file\ncarried fifteen entries and a matured stack profile, and is the\nsubstance of this harvest. PatterTech_Website ships no feedback file:\nit predates the template, which is itself a finding and is queued.",
  "Earlier rows came from the estate survey at EOS creation and from the\nVenture A reseed feedback.",
  "The PB-E04 promotion review ran the same day and promoted nothing. The\nsample: zero live `lifecycle: experimental` items, so nothing expired\npast the ninety-day window; zero `lifecycle: contested` rules; the\ntwenty-four binding rules in `packs/` unchanged; and no exception\nledger to sample, because ADR-0004 withdrew `org/exceptions.jsonl` and\nmoved a one-off exception onto the task record it applies to. Of the\nharvest's three promotion candidates, each carries one argued ruling\nfrom one venture, which under the ladder in `GOVERNANCE.md` is short\nof binding-candidate. Venture C's five draft wargames stay candidates\nfor the same reason: a fork that happened once is not a recurring fork,\nand a guide written for it would be speculation with a filename."
 ],
 "rows": [
  {
   "id": "LES-0001",
   "origin": "harvest",
   "title": "Hydration warnings are often browser-extension noise",
   "lesson": "Hydration warnings are often browser-extension noise; verify in a clean profile before treating one as a bug.",
   "venture": "Venture B",
   "source_note": "Recorded at EOS creation as \"Lesson row only, declined as doctrine (too narrow)\".",
   "evidence_class": "anecdotal",
   "disposition": "rejected",
   "outcome": "Declined. No guide id and no evidence row, on purpose.",
   "scope": "estate",
   "applicability_conditions": "Browser applications reporting hydration or client-render mismatches in development.",
   "decided": "2026-07",
   "reasoning": "Too narrow to bind, and no pack owns it."
  },
  {
   "id": "LES-0002",
   "origin": "harvest",
   "title": "Plan and build decouple, and nothing in the build is generative",
   "lesson": "Plan and build decouple: agent-driven planning, a deterministic byte-stable build, nothing generative in the build step.",
   "venture": "Venture D",
   "source_note": "Recorded at EOS creation against Venture D under the repository name it carried then, and corrected to its current name in the v2 pass on 2026-08-03.",
   "evidence_class": "observational",
   "disposition": "estate-default",
   "outcome": "Became an EOS principle, \"compiled, never composed\", in `README.md`, and the compile contract in `kernel/README.md`.",
   "scope": "eos-internal",
   "applicability_conditions": "Any pipeline where an agent plans and a tool builds. What pays is a build a second run reproduces byte for byte.",
   "informs": [
    "README.md",
    "kernel/README.md"
   ],
   "decided": "2026-07"
  },
  {
   "id": "LES-0003",
   "origin": "harvest",
   "title": "Stale docs are a bug, so delete them and ban-list the path",
   "lesson": "Stale docs are a bug: delete them, ban-list the old path in a test, never archive in place.",
   "venture": "Venture B",
   "evidence_class": "observational",
   "disposition": "estate-default",
   "outcome": "Absorbed into the supersession rules in `GOVERNANCE.md`.",
   "scope": "estate",
   "applicability_conditions": "Repositories where documentation ships with the code and a superseded document keeps its old path.",
   "informs": [
    "GOVERNANCE.md"
   ],
   "decided": "2026-07"
  },
  {
   "id": "LES-0004",
   "origin": "harvest",
   "title": "A design law one directory from the code may as well not exist",
   "lesson": "A design law that lives one directory away from the code might as well not exist.",
   "venture": "PatterTech_Website",
   "source_note": "The v4 pass.",
   "evidence_class": "observational",
   "disposition": "decision-guide",
   "outcome": "WG-WEB-013 filed by Daniel, now at `archive/v1-final:doctrine/web-design/wargames/WG-WEB-013-kit-escape-and-enforcement.md`, and carried into `packs/ui-ux/guides/GD-UIUX-004-token-source.md`.",
   "scope": "estate",
   "applicability_conditions": "Products with a design system whose tokens are enforced somewhere other than the code that consumes them.",
   "informs": [
    "WG-WEB-013",
    "packs/ui-ux/guides/GD-UIUX-004-token-source.md"
   ],
   "decided": "2026-07"
  },
  {
   "id": "LES-0005",
   "origin": "harvest",
   "title": "Uniform ceremony kills small work",
   "lesson": "Uniform ceremony kills small work; a bug fix must never need sixteen acceptance criteria.",
   "venture": "External research",
   "source_note": "Recorded at EOS creation as \"External (SDD research)\", in the estate survey rather than from a venture. No evidence row was written for it at the time and none has been written since.",
   "evidence_class": "asserted",
   "disposition": "estate-default",
   "outcome": "Became the scale system and the WG-EOS-001 mandate, and then the whole of the v2 kernel: modes, tiers and ceremony budgets, ADR-0002.",
   "scope": "eos-internal",
   "applicability_conditions": "Any process applying one ceremony to work of different sizes. It stands on the practice that followed rather than on a cited source.",
   "informs": [
    "WG-EOS-001",
    "ADR-0002",
    "kernel/SCALE_MATRIX.md"
   ],
   "decided": "2026-07"
  },
  {
   "id": "LES-0006",
   "origin": "harvest",
   "title": "Venture history in a template must be a slot, not boilerplate",
   "lesson": "Template boilerplate that states venture history must be a slot; a reseed with real history should fill it, not overwrite it.",
   "venture": "Venture A",
   "source_note": "Reseed feedback.",
   "evidence_class": "observational",
   "disposition": "estate-default",
   "outcome": "Default changed: `kernel/templates/org/CONSTITUTION.tpl.md` gained the amendment-history slot.",
   "scope": "eos-internal",
   "applicability_conditions": "Compiling a template into a repository that already has history worth preserving.",
   "informs": [
    "kernel/templates/org/CONSTITUTION.tpl.md"
   ],
   "decided": "2026-07"
  },
  {
   "id": "LES-0007",
   "origin": "harvest",
   "title": "Dark-first loses to print-native institutional brands",
   "lesson": "The dark-first surface register loses to print-native institutional brands; the ink-like clause carried a real venture.",
   "venture": "Venture A",
   "source_note": "Reseed feedback.",
   "evidence_class": "observational",
   "disposition": "venture-ruling",
   "outcome": "Argued ruling appended to WG-WEB-001, now at `archive/v1-final:doctrine/web-design/wargames/WG-WEB-001-surface-register.md`. One argued ruling from one venture, so it is not yet promotion evidence; the philosophy question it raises is carried by `packs/ui-ux/guides/GD-UIUX-001-design-philosophy.md`.",
   "scope": "estate",
   "applicability_conditions": "Brands with a print-native or institutional register. One argued ruling from one venture, which under the ladder in GOVERNANCE.md is short of promotion evidence.",
   "informs": [
    "WG-WEB-001",
    "packs/ui-ux/guides/GD-UIUX-001-design-philosophy.md"
   ],
   "decided": "2026-07"
  },
  {
   "id": "LES-0008",
   "origin": "harvest",
   "title": "Ancestry tables need preserved rows, not only compiled ones",
   "lesson": "Reseeds meet pre-EOS files; the ancestry table needs normalised and preserved row kinds beyond compiled and authored.",
   "venture": "Venture A",
   "source_note": "Reseed feedback.",
   "evidence_class": "observational",
   "disposition": "estate-default",
   "outcome": "Default changed: `kernel/templates/COMPILE_REPORT.tpl.md` documents both kinds.",
   "scope": "eos-internal",
   "applicability_conditions": "Compiling into a repository that predates the template being compiled.",
   "informs": [
    "kernel/templates/COMPILE_REPORT.tpl.md"
   ],
   "decided": "2026-07"
  },
  {
   "id": "LES-0009",
   "origin": "harvest",
   "title": "A slot pattern that excludes digits lets a slot ship unfilled",